{
  "schema_version": "1.0",
  "record_type": "context_bundle",
  "tenant_id": "018f0000-0000-7000-8000-000000000001",
  "bundle_id": "018f0000-0000-7000-8000-000000000010",
  "query_id": "018f0000-0000-7000-8000-00000000000a",
  "scope_digest": "sha256:d66c14f46d30ac1501d15e521a0488e751bd5b20aa0b826253e76e77f974fcab",
  "records": [
    {
      "memory_id": "018f0000-0000-7000-8000-00000000000b",
      "revision": 1,
      "memory_type": "fact",
      "citation": {
        "evidence_id": "018f0000-0000-7000-8000-000000000006",
        "payload_digest": "sha256:d6b92b4194c2de75a04f26af22e316c6cac6103db955db62e13a8f98a6ded6f7"
      },
      "component_scores": {
        "relevance": 900000,
        "recency": 800000,
        "confidence": 900000
      }
    }
  ],
  "retrieval_profile": "fast",
  "timeout_state": "within_budget",
  "degradation_state": "none",
  "generated_at": "2026-01-01T00:05:00.000Z",
  "bundle_digest": "sha256:431c176a4b2c200be95b9bb5dd0ad2417d7c41009820e61e49ba5cc3660c95ee"
}
